<Trace  xmlns:xsi='http://www.w3.org/2001/XMLSchema-instance' xsi:noNamespaceSchemaLocation='../xsd/BenchmarkHarnessTrace.xsd'><T p='TestServer' l='3' n='Entry(TestServer::Loop)'><V n='1'/><V n='2'/><V n='3'/><V n='4'/></T><T n='Entry(TestServer::Max)'><V n='1'/></T><T l='6' n='Exit(TestServer::Max)'><V n='1'/></T><T l='3' n='Entry(TestServer::Max)'><V n='1'/></T><T l='6' n='Exit(TestServer::Max)'><V n='1'/></T><T l='3' n='Entry(TestServer::Max)'><V n='1'/></T><T l='6' n='Exit(TestServer::Max)'><V n='1'/></T><T l='3' n='Entry(TestServer::Max)'><V n='1'/></T><T l='6' n='Exit(TestServer::Max)'><V n='1'/></T><T l='3' n='Entry(TestServer::Min)'><V n='1'/></T><T l='6' n='Exit(TestServer::Min)'><V n='1'/></T><T l='3' n='Entry(TestServer::Min)'><V n='1'/></T><T l='6' n='Exit(TestServer::Min)'><V n='1'/></T><T l='3' n='Entry(TestServer::Min)'><V n='1'/></T><T l='6' n='Exit(TestServer::Min)'><V n='1'/></T><T l='3' n='Entry(TestServer::Min)'><V n='1'/></T><T l='6' n='Exit(TestServer::Min)'><V n='1'/></T><T n='Exit(TestServer::Loop)'><V n='1'/></T><T n='Exit(TestServer::Loop)'><V n='1'/></T><T l='3' n='Entry(TestServer::Loop)'><V n='1'/><V n='2'/><V n='3'/><V n='4'/></T><T n='Entry(TestServer::Max)'><V n='1'/></T><T l='6' n='Exit(TestServer::Max)'><V n='1'/></T><T l='3' n='Entry(TestServer::Max)'><V n='1'/></T><T l='6' n='Exit(TestServer::Max)'><V n='1'/></T><T l='3' n='Entry(TestServer::Max)'><V n='1'/></T><T l='6' n='Exit(TestServer::Max)'><V n='1'/></T><T l='3' n='Entry(TestServer::Max)'><V n='1'/></T><T l='6' n='Exit(TestServer::Max)'><V n='1'/></T><T l='3' n='Entry(TestServer::Min)'><V n='1'/></T><T l='6' n='Exit(TestServer::Min)'><V n='1'/></T><T l='3' n='Entry(TestServer::Min)'><V n='1'/></T><T l='6' n='Exit(TestServer::Min)'><V n='1'/></T><T l='3' n='Entry(TestServer::Min)'><V n='1'/></T><T l='6' n='Exit(TestServer::Min)'><V n='1'/></T><T l='3' n='Entry(TestServer::Min)'><V n='1'/></T><T l='6' n='Exit(TestServer::Min)'><V n='1'/></T><T l='9' n='Exit(TestServer::Loop)'><V n='1'/><V n='2'/></T></Trace>